<?xml version="1.0" encoding="UTF-8"?>
<!DOCTYPE TestReport SYSTEM "testreport.dtd">
<?xml-stylesheet href="testreport2html.xsl" type="text/xsl"?>
<TestReport>
 <SessionData>
  <FunName>testme</FunName>
  <Strategy Coverage="all-branches" IterLimit="none" RecurLimit="none" SuffixLengthLimit="none" />
  <When>Mon Nov 20 16:07:18 2023</When>
  <Version>4.0. Build Tue May  9 15:05:46 2023</Version>
  <TestReportFile>testreport.xml</TestReportFile>
  <TestSessionFile>testsession.xml</TestSessionFile>
 </SessionData>
 <Dur>0</Dur>
 <TotalPrefixNum>2</TotalPrefixNum>
 <CoveredNum>0</CoveredNum>
 <TimeoutNum>0</TimeoutNum>
 <InfeasibleNum>2</InfeasibleNum>
 <AssumeViolatedNum>0</AssumeViolatedNum>
 <IterLimitViolatedNum>0</IterLimitViolatedNum>
 <PCBugNum>0</PCBugNum>
 <UntreatedNum>0</UntreatedNum>
 <SubsumedNum>0</SubsumedNum>
 <SuccessNum>0</SuccessNum>
 <UnknownNum>0</UnknownNum>
 <FailureNum>0</FailureNum>
 <AssertViolatedNum>0</AssertViolatedNum>
 <CrashedNum>0</CrashedNum>
 <HungNum>0</HungNum>
 <InterruptNum>0</InterruptNum>
 <UninitVarNum>0</UninitVarNum>
 <BugOracleNum>0</BugOracleNum>
 <MaybeSuccessNum>0</MaybeSuccessNum>
 <MaybeUnknownNum>0</MaybeUnknownNum>
 <MaybeFailureNum>0</MaybeFailureNum>
 <TermStatus Type="unknown">
 </TermStatus>
 <UncoveredBranches>
  <P BlocID="1003" SrcFile="/work/pathcrawler/troubleshoot.c">81a</P>
  <N BlocID="1003" SrcFile="/work/pathcrawler/troubleshoot.c">81a</N>
  <P BlocID="805" SrcFile="/work/pathcrawler/pathcrawler_tests/EchoBranches/system.h">55</P>
  <N BlocID="805" SrcFile="/work/pathcrawler/pathcrawler_tests/EchoBranches/system.h">55</N>
  <P BlocID="1007" SrcFile="/work/pathcrawler/troubleshoot.c">81b</P>
  <N BlocID="1007" SrcFile="/work/pathcrawler/troubleshoot.c">81b</N>
  <P BlocID="800" SrcFile="/work/pathcrawler/pathcrawler_tests/EchoBranches/system.h">54</P>
  <N BlocID="800" SrcFile="/work/pathcrawler/pathcrawler_tests/EchoBranches/system.h">54</N>
  <N BlocID="980" SrcFile="/work/pathcrawler/troubleshoot.c">61</N>
  <P BlocID="991" SrcFile="/work/pathcrawler/troubleshoot.c">62c</P>
  <N BlocID="991" SrcFile="/work/pathcrawler/troubleshoot.c">62c</N>
  <P BlocID="984" SrcFile="/work/pathcrawler/troubleshoot.c">62a</P>
 </UncoveredBranches>
 <UnreachableBranches />
</TestReport>